{
  "$schema": "https://json-schema.org/draft/2020-12/schema",
  "$id": "https://ga.example/contracts/seal/v1/canonical.schema.json",
  "title": "봉인 본문(canonical) v1",
  "description": "확인서 봉인 본문의 정본 정의(Phase 3B, 3A 수용심사 §3-3). canonical_hash = SHA-256(JCS(이 문서)). 포함·제외 필드는 이 스키마가 고정한다 — 확인서 번호·상태·봉인 시각·해시·체인·메타 컬럼은 들어가지 않는다(번호는 이 해시 다음에 채번된다). 최상위는 항상 객체이고 모든 객체는 닫혀 있으며 선택 값은 키를 생략하지 않고 null이다. 정수는 |n| ≤ 2^53−1(JCS가 숫자를 IEEE-754 double로 직렬화한다), 소수는 없다(CLAUDE.md 절대 규칙 1). 항목은 item_no 순, 항목값은 {코드: 값}이며 출처(origin)는 증거 패키지에만 있다. 패널·상품군 이름·사유 라벨은 고정 룰·서식·상담일 카탈로그에서 해석한 문자열 결과다(3B 계획 승인 Q11).",
  "type": "object",
  "required": [
    "canonicalVersion",
    "tenantId",
    "disclosureId",
    "version",
    "supersedesId",
    "agentId",
    "customerRef",
    "customerName",
    "consultDate",
    "productGroup",
    "issuerMode",
    "pinned",
    "snapshot",
    "panel",
    "items"
  ],
  "additionalProperties": false,
  "properties": {
    "canonicalVersion": {
      "const": 1
    },
    "tenantId": {
      "type": "string",
      "pattern": "^[A-Z0-9][A-Z0-9_]{0,31}$"
    },
    "disclosureId": {
      "$ref": "#/$defs/uuid"
    },
    "version": {
      "type": "integer",
      "minimum": 1,
      "maximum": 32767
    },
    "supersedesId": {
      "oneOf": [
        {
          "$ref": "#/$defs/uuid"
        },
        {
          "type": "null"
        }
      ]
    },
    "agentId": {
      "type": "string",
      "minLength": 1,
      "maxLength": 128
    },
    "customerRef": {
      "type": "string",
      "pattern": "^CR-[0-9a-f]{32}$"
    },
    "customerName": {
      "type": "string",
      "minLength": 1,
      "maxLength": 100,
      "description": "봉인 때 복호화한 고객 성명(감사 CUSTOMER_VIEW, 사유 SEAL). PDF에 인쇄되는 유일한 개인정보다."
    },
    "consultDate": {
      "$ref": "#/$defs/date"
    },
    "productGroup": {
      "type": "object",
      "additionalProperties": false,
      "required": [
        "code",
        "name"
      ],
      "properties": {
        "code": {
          "$ref": "#/$defs/code"
        },
        "name": {
          "$ref": "#/$defs/text"
        }
      }
    },
    "issuerMode": {
      "enum": [
        "SELF",
        "ASSOC"
      ]
    },
    "pinned": {
      "type": "object",
      "additionalProperties": false,
      "required": [
        "ruleVersionId",
        "tenantRuleVersionId",
        "templateId",
        "templateVersion"
      ],
      "properties": {
        "ruleVersionId": {
          "$ref": "#/$defs/code"
        },
        "tenantRuleVersionId": {
          "oneOf": [
            {
              "$ref": "#/$defs/code"
            },
            {
              "type": "null"
            }
          ]
        },
        "templateId": {
          "$ref": "#/$defs/code"
        },
        "templateVersion": {
          "type": "integer",
          "minimum": 1,
          "maximum": 2147483647
        }
      }
    },
    "snapshot": {
      "type": "object",
      "additionalProperties": false,
      "required": [
        "snapshotId",
        "gradingPolicyVersionId",
        "rankingPolicyVersionId",
        "tieBreak",
        "basis",
        "generatedAt"
      ],
      "properties": {
        "snapshotId": {
          "$ref": "#/$defs/text"
        },
        "gradingPolicyVersionId": {
          "$ref": "#/$defs/text"
        },
        "rankingPolicyVersionId": {
          "$ref": "#/$defs/text"
        },
        "tieBreak": {
          "enum": [
            "SHARED_RANK",
            "STRICT"
          ]
        },
        "basis": {
          "$ref": "#/$defs/jsonObject"
        },
        "generatedAt": {
          "type": "string",
          "pattern": "^\\d{4}-\\d{2}-\\d{2}T\\d{2}:\\d{2}:\\d{2}(\\.\\d{1,9})?Z$"
        }
      }
    },
    "panel": {
      "type": "array",
      "minItems": 1,
      "items": {
        "type": "object",
        "additionalProperties": false,
        "required": [
          "insurerCode",
          "insurerName"
        ],
        "properties": {
          "insurerCode": {
            "$ref": "#/$defs/code"
          },
          "insurerName": {
            "$ref": "#/$defs/text"
          }
        }
      }
    },
    "items": {
      "type": "array",
      "minItems": 1,
      "maxItems": 50,
      "items": {
        "$ref": "#/$defs/item"
      }
    }
  },
  "not": {
    "$ref": "#/$defs/forbiddenKeys"
  },
  "$defs": {
    "item": {
      "type": "object",
      "additionalProperties": false,
      "required": [
        "itemNo",
        "productKey",
        "insurerCode",
        "productName",
        "groupCode",
        "tempProduct",
        "quoteDocNo",
        "recommended",
        "requestedByCustomer",
        "fieldValues",
        "grade",
        "recommendation"
      ],
      "not": {
        "$ref": "#/$defs/forbiddenKeys"
      },
      "properties": {
        "itemNo": {
          "type": "integer",
          "minimum": 1,
          "maximum": 50
        },
        "productKey": {
          "oneOf": [
            {
              "type": "string",
              "maxLength": 40
            },
            {
              "type": "null"
            }
          ]
        },
        "insurerCode": {
          "$ref": "#/$defs/code"
        },
        "productName": {
          "$ref": "#/$defs/text"
        },
        "groupCode": {
          "$ref": "#/$defs/code"
        },
        "tempProduct": {
          "type": "boolean"
        },
        "quoteDocNo": {
          "oneOf": [
            {
              "$ref": "#/$defs/text"
            },
            {
              "type": "null"
            }
          ]
        },
        "recommended": {
          "type": "boolean"
        },
        "requestedByCustomer": {
          "type": "boolean"
        },
        "fieldValues": {
          "type": "object",
          "propertyNames": {
            "pattern": "^[A-Z][A-Z0-9_]{0,63}$"
          },
          "additionalProperties": {
            "$ref": "#/$defs/jsonValue"
          }
        },
        "grade": {
          "oneOf": [
            {
              "type": "object",
              "additionalProperties": false,
              "required": [
                "status",
                "source",
                "grade",
                "gradeLabel",
                "gradeOrdinal",
                "rankInSet",
                "ratioToAvg",
                "tie"
              ],
              "properties": {
                "status": {
                  "const": "OK"
                },
                "source": {
                  "const": "ENGINE"
                },
                "grade": {
                  "$ref": "#/$defs/text"
                },
                "gradeLabel": {
                  "$ref": "#/$defs/text"
                },
                "gradeOrdinal": {
                  "type": "integer",
                  "minimum": 1,
                  "maximum": 32767
                },
                "rankInSet": {
                  "type": "integer",
                  "minimum": 1,
                  "maximum": 32767
                },
                "ratioToAvg": {
                  "type": "string",
                  "description": "엔진 원문(불투명 문자열). 인쇄하지 않는다(설계서 §6.3)"
                },
                "tie": {
                  "type": "boolean"
                }
              }
            },
            {
              "type": "object",
              "additionalProperties": false,
              "required": [
                "status",
                "source",
                "reason"
              ],
              "properties": {
                "status": {
                  "const": "UNAVAILABLE"
                },
                "source": {
                  "enum": [
                    "ENGINE",
                    "LOCAL"
                  ]
                },
                "reason": {
                  "$ref": "#/$defs/text"
                }
              }
            }
          ]
        },
        "recommendation": {
          "oneOf": [
            {
              "type": "null"
            },
            {
              "type": "object",
              "additionalProperties": false,
              "required": [
                "reasons",
                "text"
              ],
              "properties": {
                "reasons": {
                  "type": "array",
                  "minItems": 1,
                  "items": {
                    "type": "object",
                    "additionalProperties": false,
                    "required": [
                      "code",
                      "label"
                    ],
                    "properties": {
                      "code": {
                        "$ref": "#/$defs/code"
                      },
                      "label": {
                        "$ref": "#/$defs/text"
                      }
                    }
                  }
                },
                "text": {
                  "oneOf": [
                    {
                      "type": "string"
                    },
                    {
                      "type": "null"
                    }
                  ]
                }
              }
            }
          ]
        }
      }
    },
    "forbiddenKeys": {
      "description": "봉인 본문에 들어갈 수 없는 키 — 번호·상태·시각·해시·체인·메타·성명 외 개인정보·등록 키(지시문 S3)",
      "anyOf": [
        {
          "required": [
            "disclosureNo"
          ]
        },
        {
          "required": [
            "status"
          ]
        },
        {
          "required": [
            "sealedAt"
          ]
        },
        {
          "required": [
            "canonicalHash"
          ]
        },
        {
          "required": [
            "pdfHash"
          ]
        },
        {
          "required": [
            "chainHash"
          ]
        },
        {
          "required": [
            "chainSeq"
          ]
        },
        {
          "required": [
            "retentionUntil"
          ]
        },
        {
          "required": [
            "policyNo"
          ]
        },
        {
          "required": [
            "contractDate"
          ]
        },
        {
          "required": [
            "phone"
          ]
        },
        {
          "required": [
            "birthDate"
          ]
        },
        {
          "required": [
            "registrationKey"
          ]
        }
      ]
    },
    "jsonValue": {
      "anyOf": [
        {
          "type": "string"
        },
        {
          "type": "boolean"
        },
        {
          "type": "integer",
          "minimum": -9007199254740991,
          "maximum": 9007199254740991
        },
        {
          "type": "array",
          "items": {
            "$ref": "#/$defs/jsonValue"
          }
        },
        {
          "$ref": "#/$defs/jsonObject"
        }
      ]
    },
    "jsonObject": {
      "type": "object",
      "additionalProperties": {
        "$ref": "#/$defs/jsonValue"
      }
    },
    "uuid": {
      "type": "string",
      "pattern": "^[0-9a-f]{8}-[0-9a-f]{4}-[0-9a-f]{4}-[0-9a-f]{4}-[0-9a-f]{12}$"
    },
    "date": {
      "type": "string",
      "pattern": "^\\d{4}-\\d{2}-\\d{2}$"
    },
    "code": {
      "type": "string",
      "minLength": 1,
      "maxLength": 64
    },
    "text": {
      "type": "string",
      "minLength": 1,
      "maxLength": 1000
    }
  }
}
