{"agentId":"agent-1@demo","canonicalVersion":1,"consultDate":"2026-09-23","customerName":"가상고객","customerRef":"CR-00000000000000000000000000000007","disclosureId":"00000000-0000-4000-8000-000000000002","issuerMode":"SELF","items":[{"fieldValues":{"PREMIUM":32101,"SURRENDER_VALUE_EXAMPLE":[{"refundWon":0,"year":10}]},"grade":{"grade":"LOW","gradeLabel":"낮음","gradeOrdinal":2,"rankInSet":1,"ratioToAvg":"0.84","source":"ENGINE","status":"OK","tie":false},"groupCode":"PG-HEALTH-SIMPLE-NR","insurerCode":"INS-A","itemNo":1,"productKey":"INS-A:PRD-1001","productName":"(가상) INS-A:PRD-1001","quoteDocNo":null,"recommendation":{"reasons":[{"code":"PREMIUM","label":"보험료 수준"}],"text":null},"recommended":true,"requestedByCustomer":false,"tempProduct":false},{"fieldValues":{"PREMIUM":30100,"SURRENDER_VALUE_EXAMPLE":"가입설계서 Q-2026-0001 참조"},"grade":{"reason":"TEMP_PRODUCT","source":"LOCAL","status":"UNAVAILABLE"},"groupCode":"PG-HEALTH-SIMPLE-NR","insurerCode":"INS-B","itemNo":2,"productKey":null,"productName":"(가상) 다라생명 신상품","quoteDocNo":"Q-2026-0001","recommendation":{"reasons":[{"code":"OTHER","label":"기타"}],"text":"고객이 기존 계약의 보장 공백을 우려하여 입원·수술 보장을 우선했고, 보험료 납입 여력과 갱신 구조를 함께 비교한 결과 이 상품이 고객의 요청 조건에 가장 가깝다고 판단함. 해약환급금이 적다는 점과 무해지 구조의 의미를 설명하였고 고객이 이해했음을 확인함."},"recommended":true,"requestedByCustomer":false,"tempProduct":true},{"fieldValues":{"PREMIUM":32103,"SURRENDER_VALUE_EXAMPLE":[{"refundWon":0,"year":10}]},"grade":{"reason":"NO_RATE_DATA","source":"ENGINE","status":"UNAVAILABLE"},"groupCode":"PG-HEALTH-SIMPLE-NR","insurerCode":"INS-C","itemNo":3,"productKey":"INS-C:PRD-3120","productName":"(가상) INS-C:PRD-3120","quoteDocNo":null,"recommendation":null,"recommended":false,"requestedByCustomer":false,"tempProduct":false}],"panel":[{"insurerCode":"INS-A","insurerName":"(가상) 가나생명"},{"insurerCode":"INS-B","insurerName":"(가상) 다라생명"},{"insurerCode":"INS-C","insurerName":"(가상) 마바생명"},{"insurerCode":"INS-D","insurerName":"(가상) 사아손보"},{"insurerCode":"INS-E","insurerName":"(가상) 자차손보"}],"pinned":{"ruleVersionId":"DISC-2026-07","templateId":"STANDARD","templateVersion":1,"tenantRuleVersionId":null},"productGroup":{"code":"PG-HEALTH-SIMPLE-NR","name":"(가상) 간편건강 무해지"},"snapshot":{"basis":{"groupAvgSource":"ASSOC_DISCLOSURE","groupPopulation":27,"period":"2026Q2"},"generatedAt":"2026-09-23T00:30:00Z","gradingPolicyVersionId":"GRADING-2026-07","rankingPolicyVersionId":"RANK-2026-07","snapshotId":"GRD-0000001","tieBreak":"SHARED_RANK"},"supersedesId":null,"tenantId":"DEMO1","version":1}